address,lat,lng,name,url
"berkeley, california, united states",37.8753497,-122.23963364918777,NERSC,https://www.nersc.gov/
"edinburgh, united kingdom",55.9533456,-3.1883749,EPCC,https://www.epcc.ed.ac.uk/
"cambridge, massachusetts, united states",42.3750997,-71.1056157,MIT Office of Research Computing and Data,https://orcd.mit.edu/
"zagreb, zagreb, croatia",45.84264135,15.962231476593626,University of Zagreb- University Computing Centre- Croatia,https://www.srce.hr/en/
"lubbock, texas, united states",33.5635206,-101.879336,Texas Tech University High Performance Computing Center,https://www.depts.ttu.edu/hpcc
